{
  "id": "vp-q2-l02",
  "programAreaId": "video-production",
  "quarter": "Q2",
  "unit": "DaVinci Resolve Foundations",
  "lessonNumber": 2,
  "title": "Media Page, Imports, and Bins",
  "status": "draft-pilot",
  "video": {
    "source": "Casey Faris / Ground Control: Introduction to DaVinci Resolve",
    "start": "00:13:16",
    "end": "00:25:47",
    "url": "https://youtu.be/MCDVcQIA3UM?t=796s",
    "note": "Covers the Media page, media storage, Media Pool, importing clips, changing frame-rate prompts, bins, folder structure, list and thumbnail views, metadata, keywords, and smart-bin awareness."
  },
  "learningTarget": "I can import footage into the Media Pool and organize it with bins so my edit can be built from clean source material.",
  "bellRinger": {
    "type": "short-response",
    "prompt": "When you have a folder full of random clips, what information helps you find the right shot quickly?"
  },
  "vocabulary": [
    {
      "term": "Media page",
      "definition": "The Resolve workspace focused on finding, previewing, importing, and organizing media."
    },
    {
      "term": "Media Storage",
      "definition": "The panel used to browse files on the computer or connected drives."
    },
    {
      "term": "Media Pool",
      "definition": "The project area that contains clips, audio, timelines, and bins available to the edit."
    },
    {
      "term": "Bin",
      "definition": "A folder inside the Resolve project used to organize media."
    },
    {
      "term": "Metadata",
      "definition": "Information about a clip, such as shot, scene, take, comments, or technical details."
    },
    {
      "term": "Smart bin",
      "definition": "A bin that gathers clips automatically based on rules or metadata filters."
    }
  ],
  "slides": {
    "title": "Lesson 02 - Media Page, Imports, and Bins",
    "url": "https://docs.google.com/presentation/d/13PT__0PLlXTf3YxLYJOZz-JeTe_lM_LC/edit?usp=sharing&ouid=107038757575028800661&rtpof=true&sd=true",
    "status": "created"
  },
  "assignment": {
    "id": "vp-q2-a02",
    "title": "Organized Media Pool",
    "submissionType": "google-drive-link-and-reflection",
    "evidenceRequired": [
      "A Google Docs or Drive link containing a Media Pool screenshot with at least three organized bins.",
      "In the same evidence document or folder, a screenshot or notes showing two metadata/description entries on different clips.",
      "A 2-3 sentence reflection entered in DCC explaining one bin or note choice that will speed up editing."
    ],
    "reflectionPrompt": "In 2-3 sentences, name one bin or note choice you made and explain how it will make a particular clip easier to find next class."
  },
  "exitTicket": "What is the difference between media sitting on the computer and media imported into the Resolve Media Pool?",
  "tags": [
    "video-production",
    "davinci-resolve",
    "q2",
    "resolve-foundations",
    "lesson-02"
  ]
}
