{
  "id": "ue-q3-l04",
  "programAreaId": "unreal-engine",
  "quarter": "Q3",
  "unit": "Castle Environment Production",
  "lessonNumber": 4,
  "title": "Landscape Blockout",
  "status": "draft-pilot",
  "video": {
    "source": "Q3 Unreal Castle Documentary Project",
    "start": "N/A",
    "end": "N/A",
    "url": "",
    "note": "Students build a castle environment in Unreal Engine while recording daily screen/camera evidence for a making-of documentary."
  },
  "learningTarget": "I can block out terrain forms for a castle environment and document how the terrain supports the route, focal point, and story.",
  "bellRinger": {
    "type": "short-response",
    "prompt": "What terrain features could make a castle feel protected, isolated, or dramatic?"
  },
  "vocabulary": [
    {
      "term": "Production log",
      "definition": "A dated record of what was built, what was captured, what changed, and what needs to happen next."
    },
    {
      "term": "Screen recording",
      "definition": "Video captured from the computer screen to show workflow, testing, or before/after changes."
    },
    {
      "term": "Behind-the-scenes footage",
      "definition": "Camera or screen-recorded evidence that shows how a project was made."
    },
    {
      "term": "B-roll",
      "definition": "Supporting footage that helps explain a process, place, detail, or action."
    },
    {
      "term": "Castle environment",
      "definition": "The Q3 Unreal scene students build, refine, walk through, and document."
    }
  ],
  "slides": {
    "title": "Q3 Lesson 04 - Landscape Blockout",
    "url": "",
    "status": "ready-for-chatgpt"
  },
  "assignment": {
    "id": "ue-q3-a04",
    "title": "Castle Landscape Blockout",
    "submissionType": "google-drive-or-youtube-link-and-reflection",
    "evidenceRequired": [
      "Top-down screenshot of the landscape blockout.",
      "Player-view screenshot showing the route or focal point.",
      "Daily screen recording showing a terrain/blockout decision.",
      "Production log entry for today."
    ]
  },
  "exitTicket": "What part of your blockout did you capture that guides the viewer toward the castle?",
  "tags": [
    "landscape",
    "blockout",
    "castle-environment",
    "q3",
    "daily-documentary",
    "screen-recording",
    "process-documentation"
  ]
}
