{
  "id": "ue-q1-l04",
  "programAreaId": "unreal-engine",
  "quarter": "Q1",
  "unit": "Unreal Foundations",
  "lessonNumber": 4,
  "title": "Moving, Rotating, and Scaling Objects",
  "status": "pilot-ready",
  "video": {
    "source": "Unreal Engine 5 Beginner Tutorial Transcript",
    "start": "00:17:31",
    "end": "00:27:14",
    "url": "https://www.youtube.com/watch?v=k-zMkzmduqI&t=1051s"
  },
  "learningTarget": "I can build a simple starter scene by moving, rotating, scaling, duplicating, and placing objects from the toolbar and Content Drawer.",
  "bellRinger": {
    "type": "short-response",
    "prompt": "What is the difference between moving an object and changing the camera view?"
  },
  "vocabulary": [
    {
      "term": "Translate",
      "definition": "Move an object along one or more axes."
    },
    {
      "term": "Rotate",
      "definition": "Turn an object around an axis."
    },
    {
      "term": "Scale",
      "definition": "Change the size or proportions of an object."
    },
    {
      "term": "Gizmo",
      "definition": "The colored handles used to move, rotate, or scale selected objects."
    },
    {
      "term": "Snapping",
      "definition": "A setting that moves, rotates, or scales objects in set increments."
    },
    {
      "term": "Local Transform",
      "definition": "Moving or rotating based on the selected object direction instead of the world direction."
    }
  ],
  "slides": {
    "title": "Lesson 04 - Moving, Rotating, and Scaling Objects",
    "url": "https://docs.google.com/presentation/d/1LFGefL99v7JRNFPToMnWSDV7wFeu6Pnj/edit?usp=sharing&ouid=107038757575028800661&rtpof=true&sd=true",
    "status": "created"
  },
  "assignment": {
    "id": "ue-q1-a04",
    "title": "Starter Scene Transform Challenge",
    "submissionType": "screenshot-and-reflection",
    "evidenceRequired": [
      "Screenshot of completed simple scene",
      "Short reflection naming at least three tools or shortcuts used"
    ]
  },
  "exitTicket": "What are the W, E, and R shortcuts used for in Unreal?",
  "tags": [
    "transforms",
    "snapping",
    "duplication",
    "starter-scene"
  ]
}
