{
  "id": "vp-q2-l04",
  "programAreaId": "video-production",
  "quarter": "Q2",
  "unit": "DaVinci Resolve Foundations",
  "lessonNumber": 4,
  "title": "Trimming Clips and Building a Rough Cut",
  "status": "draft-pilot",
  "video": {
    "source": "Casey Faris / Ground Control: Introduction to DaVinci Resolve",
    "start": "00:35:30",
    "end": "01:07:04",
    "url": "https://youtu.be/MCDVcQIA3UM?t=2130s",
    "note": "Covers trimming clip edges, removing excess slate or dead time, choosing story moments, setting in and out points, adding selected ranges to a timeline, insert and append edits, trim mode, ripple trimming, split edits, and keyboard shortcut awareness."
  },
  "learningTarget": "I can trim clips, set in and out points, and build a rough cut that communicates a simple story without unnecessary dead space.",
  "bellRinger": {
    "type": "short-response",
    "prompt": "What makes a video clip feel too long, even if the shot itself is useful?"
  },
  "vocabulary": [
    {
      "term": "Trim",
      "definition": "To shorten or extend a clip by adjusting where it starts or ends."
    },
    {
      "term": "In point",
      "definition": "The selected start of the part of a source clip that will be used."
    },
    {
      "term": "Out point",
      "definition": "The selected end of the part of a source clip that will be used."
    },
    {
      "term": "Rough cut",
      "definition": "An early version of an edit focused on order, timing, and story instead of polish."
    },
    {
      "term": "Insert edit",
      "definition": "An edit that places a clip and pushes later material down the timeline."
    },
    {
      "term": "Ripple trim",
      "definition": "A trim that closes or opens timeline space so clips stay connected."
    },
    {
      "term": "Blade or split",
      "definition": "A cut that divides one clip into separate pieces."
    }
  ],
  "slides": {
    "title": "Lesson 04 - Trimming Clips and Building a Rough Cut",
    "url": "https://docs.google.com/presentation/d/14y8n5yg0u8gLSpdFIgkeZNpREeoUtLJm/edit?usp=sharing&ouid=107038757575028800661&rtpof=true&sd=true",
    "status": "created"
  },
  "assignment": {
    "id": "vp-q2-a04",
    "title": "Rough Cut Story Sequence",
    "submissionType": "google-drive-link-and-reflection",
    "evidenceRequired": [
      "A Google Docs or Drive link containing a screenshot of the 30-60 second rough cut timeline with at least four clips and its runtime visible.",
      "In the same evidence document, name two source clips on which you set in/out points and explain what you kept.",
      "A 2-3 sentence reflection entered in DCC naming three tools/actions used and explaining the most useful trim."
    ],
    "reflectionPrompt": "In 2-3 sentences, name three tools or editing actions you used, then explain which trim most improved your story or pacing."
  },
  "exitTicket": "Name one trimming tool or shortcut you used today and explain what it changed in your rough cut.",
  "tags": [
    "video-production",
    "davinci-resolve",
    "q2",
    "resolve-foundations",
    "lesson-04"
  ]
}
