{
  "id": "ue-q3-l08",
  "programAreaId": "unreal-engine",
  "quarter": "Q3",
  "unit": "Castle Environment Production",
  "lessonNumber": 8,
  "title": "Castle Modular Kit",
  "status": "draft-pilot",
  "video": {
    "source": "Q3 Unreal Castle Documentary Project",
    "start": "N/A",
    "end": "N/A",
    "url": "",
    "note": "Students build a castle environment in Unreal Engine while recording daily screen/camera evidence for a making-of documentary."
  },
  "learningTarget": "I can assemble modular castle pieces into a readable structure while documenting construction choices for the final documentary.",
  "bellRinger": {
    "type": "short-response",
    "prompt": "Why are modular pieces useful when building a castle or game environment?"
  },
  "vocabulary": [
    {
      "term": "Production log",
      "definition": "A dated record of what was built, what was captured, what changed, and what needs to happen next."
    },
    {
      "term": "Screen recording",
      "definition": "Video captured from the computer screen to show workflow, testing, or before/after changes."
    },
    {
      "term": "Behind-the-scenes footage",
      "definition": "Camera or screen-recorded evidence that shows how a project was made."
    },
    {
      "term": "B-roll",
      "definition": "Supporting footage that helps explain a process, place, detail, or action."
    },
    {
      "term": "Castle environment",
      "definition": "The Q3 Unreal scene students build, refine, walk through, and document."
    }
  ],
  "slides": {
    "title": "Q3 Lesson 08 - Castle Modular Kit",
    "url": "",
    "status": "ready-for-chatgpt"
  },
  "assignment": {
    "id": "ue-q3-a08",
    "title": "Castle Modular Kit Assembly",
    "submissionType": "google-drive-or-youtube-link-and-reflection",
    "evidenceRequired": [
      "Screenshot of the castle modular section.",
      "Daily documentary clip showing castle construction progress.",
      "Production log entry for today."
    ]
  },
  "exitTicket": "What construction choice did your footage capture today?",
  "tags": [
    "placeholder",
    "unreal-engine",
    "q3",
    "castle-environment",
    "daily-documentary",
    "screen-recording",
    "process-documentation"
  ]
}
