{
  "id": "ue-q3-l13",
  "programAreaId": "unreal-engine",
  "quarter": "Q3",
  "unit": "Castle Environment Production",
  "lessonNumber": 13,
  "title": "Quiz 3 and Lighting Mood",
  "status": "draft-pilot",
  "video": {
    "source": "Q3 Unreal Castle Documentary Project",
    "start": "N/A",
    "end": "N/A",
    "url": "",
    "note": "Students build a castle environment in Unreal Engine while recording daily screen/camera evidence for a making-of documentary."
  },
  "learningTarget": "I can review scene-building concepts and improve lighting mood while documenting how lighting changes the castle environment.",
  "bellRinger": {
    "type": "short-response",
    "prompt": "How can lighting make the same castle feel safe, mysterious, or dangerous?"
  },
  "vocabulary": [
    {
      "term": "Production log",
      "definition": "A dated record of what was built, what was captured, what changed, and what needs to happen next."
    },
    {
      "term": "Screen recording",
      "definition": "Video captured from the computer screen to show workflow, testing, or before/after changes."
    },
    {
      "term": "Behind-the-scenes footage",
      "definition": "Camera or screen-recorded evidence that shows how a project was made."
    },
    {
      "term": "B-roll",
      "definition": "Supporting footage that helps explain a process, place, detail, or action."
    },
    {
      "term": "Castle environment",
      "definition": "The Q3 Unreal scene students build, refine, walk through, and document."
    }
  ],
  "slides": {
    "title": "Q3 Lesson 13 - Quiz 3 and Lighting Mood",
    "url": "",
    "status": "ready-for-chatgpt"
  },
  "assignment": {
    "id": "ue-q3-a13",
    "title": "Lighting Mood Pass",
    "submissionType": "google-drive-or-youtube-link-and-reflection",
    "evidenceRequired": [
      "Before/after screenshots showing lighting mood.",
      "Daily documentary clip showing lighting adjustment.",
      "Production log entry for today."
    ]
  },
  "exitTicket": "What lighting change did your documentary evidence capture today?",
  "tags": [
    "placeholder",
    "unreal-engine",
    "q3",
    "castle-environment",
    "daily-documentary",
    "screen-recording",
    "process-documentation"
  ]
}
