{
  "id": "ue-q3-l16",
  "programAreaId": "unreal-engine",
  "quarter": "Q3",
  "unit": "Castle Environment Production",
  "lessonNumber": 16,
  "title": "Final Critique and Portfolio Submission",
  "status": "draft-pilot",
  "video": {
    "source": "Q3 Unreal Castle Documentary Project",
    "start": "N/A",
    "end": "N/A",
    "url": "",
    "note": "Students build a castle environment in Unreal Engine while recording daily screen/camera evidence for a making-of documentary."
  },
  "learningTarget": "I can prepare final castle evidence and organize documentary footage into a clear making-of story.",
  "bellRinger": {
    "type": "short-response",
    "prompt": "What should the final documentary prove about your process, not just your finished castle?"
  },
  "vocabulary": [
    {
      "term": "Production log",
      "definition": "A dated record of what was built, what was captured, what changed, and what needs to happen next."
    },
    {
      "term": "Screen recording",
      "definition": "Video captured from the computer screen to show workflow, testing, or before/after changes."
    },
    {
      "term": "Behind-the-scenes footage",
      "definition": "Camera or screen-recorded evidence that shows how a project was made."
    },
    {
      "term": "B-roll",
      "definition": "Supporting footage that helps explain a process, place, detail, or action."
    },
    {
      "term": "Castle environment",
      "definition": "The Q3 Unreal scene students build, refine, walk through, and document."
    }
  ],
  "slides": {
    "title": "Q3 Lesson 16 - Final Critique and Portfolio Submission",
    "url": "",
    "status": "ready-for-chatgpt"
  },
  "assignment": {
    "id": "ue-q3-a16",
    "title": "Castle Documentary and Portfolio Submission",
    "submissionType": "google-drive-or-youtube-link-and-reflection",
    "evidenceRequired": [
      "Final castle screenshots or walkthrough link.",
      "Organized documentary evidence folder or edited documentary draft link.",
      "Final production reflection describing the castle build process.",
      "Production log summary for the Q3 project."
    ]
  },
  "exitTicket": "What is the strongest evidence that shows your growth during this project?",
  "tags": [
    "placeholder",
    "unreal-engine",
    "q3",
    "castle-environment",
    "daily-documentary",
    "screen-recording",
    "process-documentation"
  ]
}
