{
  "id": "vp-q2-l06",
  "programAreaId": "video-production",
  "quarter": "Q2",
  "unit": "DaVinci Resolve Foundations",
  "lessonNumber": 6,
  "title": "Titles, Transitions, and Simple Motion",
  "status": "draft-pilot",
  "video": {
    "source": "Casey Faris / Ground Control: Introduction to DaVinci Resolve",
    "start": "01:20:08",
    "end": "01:30:41",
    "url": "https://youtu.be/MCDVcQIA3UM?t=4808s",
    "note": "Covers the Effects panel, transitions, generators, titles, Fusion titles awareness, basic text title controls, inspector adjustments, position settings, simple keyframes, and using titles or motion only where they support the edit."
  },
  "learningTarget": "I can add a readable title or lower third and use a transition or simple motion choice only when it supports the video.",
  "bellRinger": {
    "type": "short-response",
    "prompt": "When does a title help a video, and when can it distract from the video?"
  },
  "vocabulary": [
    {
      "term": "Effects panel",
      "definition": "The panel that contains transitions, titles, generators, and other edit-page effects."
    },
    {
      "term": "Transition",
      "definition": "A visual change between two clips, such as a dissolve or wipe."
    },
    {
      "term": "Title",
      "definition": "Generated text placed over or between video clips."
    },
    {
      "term": "Lower third",
      "definition": "A title placed in the lower part of the screen, often used for names or labels."
    },
    {
      "term": "Generator",
      "definition": "A generated visual element such as a color or gradient."
    },
    {
      "term": "Keyframe",
      "definition": "A point in time that stores a value so an effect or property can change over time."
    },
    {
      "term": "Inspector",
      "definition": "The panel used to adjust selected titles, clips, transitions, and effects."
    }
  ],
  "slides": {
    "title": "Lesson 06 - Titles, Transitions, and Simple Motion",
    "url": "https://docs.google.com/presentation/d/17VCMFPLZ9qz722hMM5mkbwqgotik79KZ/edit?usp=sharing&ouid=107038757575028800661&rtpof=true&sd=true",
    "status": "created"
  },
  "assignment": {
    "id": "vp-q2-a06",
    "title": "Title and Transition Polish Pass",
    "submissionType": "google-drive-link-and-reflection",
    "evidenceRequired": [
      "A Google Docs or Drive link containing a screenshot of your title/lower third selected in the timeline, with its text or Inspector controls visible.",
      "In the same evidence document, note your title's duration and explain one readability check and your transition or clean-cut choice.",
      "A 2-3 sentence reflection entered in DCC explaining how the title supports the viewer's understanding."
    ],
    "reflectionPrompt": "In 2-3 sentences, explain what your title tells the viewer, how you made it readable, and why you chose a transition or a clean cut."
  },
  "exitTicket": "What title, transition, or motion choice did you add, and why does it belong in the edit?",
  "tags": [
    "video-production",
    "davinci-resolve",
    "q2",
    "resolve-foundations",
    "lesson-06"
  ]
}
