{
  "id": "ue-q1-l16",
  "programAreaId": "unreal-engine",
  "quarter": "Q1",
  "unit": "Unreal Foundations",
  "lessonNumber": 16,
  "title": "Foliage, Mini-World, and Blueprint Preview",
  "status": "draft-pilot",
  "video": {
    "source": "Unreal Engine 5 Beginner Tutorial Transcript",
    "start": "04:19:04",
    "end": "04:33:12",
    "url": "https://www.youtube.com/watch?v=k-zMkzmduqI&t=15544s",
    "note": "Primary range covers adding trees to Foliage mode, density adjustment, Align to Normal, mobility, scale checks with the mannequin, paint and single instance placement, moving selected foliage, LOD/performance awareness, and play testing the world. Blueprint preview connection references 02:56:37-03:20:24, and final playable-space detailing references 04:57:25-04:59:31."
  },
  "learningTarget": "I can add environmental detail to a small Unreal scene and explain how foliage, props, and simple interaction prepare a scene for a playable mini-world.",
  "bellRinger": {
    "type": "short-response",
    "prompt": "What details make an environment feel alive or intentionally designed?"
  },
  "vocabulary": [
    {
      "term": "Foliage",
      "definition": "Trees, grass, plants, and similar environment detail placed across a scene."
    },
    {
      "term": "Prop",
      "definition": "A placed object that adds detail, function, or story to a scene."
    },
    {
      "term": "Environment pass",
      "definition": "A focused improvement pass that adds believable detail to an environment."
    },
    {
      "term": "Player path",
      "definition": "The route a player is encouraged to follow through a space."
    },
    {
      "term": "Focal point",
      "definition": "The area the viewer or player should notice first."
    },
    {
      "term": "Density",
      "definition": "How many foliage instances appear in an area."
    },
    {
      "term": "Variation",
      "definition": "Differences in scale, rotation, color, or placement that make repeated assets feel natural."
    },
    {
      "term": "Blueprint",
      "definition": "A visual scripting asset used to create behavior or interaction in Unreal."
    },
    {
      "term": "Trigger",
      "definition": "A volume or event that starts an action when something overlaps or activates it."
    },
    {
      "term": "Playable space",
      "definition": "An area designed to be explored or used by a player."
    }
  ],
  "slides": {
    "title": "Lesson 16 - Foliage, Mini-World, and Blueprint Preview",
    "url": "https://docs.google.com/presentation/d/1uKPGeRBGj2_WTqCVPo-2omRKtbCRtnPU/edit?usp=sharing&ouid=107038757575028800661&rtpof=true&sd=true",
    "status": "created"
  },
  "assignment": {
    "id": "ue-q1-a16",
    "title": "Mini-World Environment Pass",
    "submissionType": "google-drive-screenshot-links-and-reflection",
    "evidenceRequired": [
      "Google Drive link to a wide screenshot of mini-world environment.",
      "Google Drive link to a close-up screenshot showing foliage or prop detail.",
      "Google Drive link to a screenshot or written description of simple interaction or Blueprint preview.",
      "Short reflection explaining how the scene became more believable or playable."
    ]
  },
  "exitTicket": "What one detail made your mini-world feel more believable or playable?",
  "tags": [
    "lesson-16",
    "unreal-engine",
    "q1",
    "unreal-foundations",
    "foliage-mode-setup",
    "density-and-scale-control",
    "mini-world-composition"
  ]
}
