{
  "id": "ue-q3-l10",
  "programAreaId": "unreal-engine",
  "quarter": "Q3",
  "unit": "Castle Environment Production",
  "lessonNumber": 10,
  "title": "Rocks, Cliffs, and Scene Framing",
  "status": "draft-pilot",
  "video": {
    "source": "Q3 Unreal Castle Documentary Project",
    "start": "N/A",
    "end": "N/A",
    "url": "",
    "note": "Students build a castle environment in Unreal Engine while recording daily screen/camera evidence for a making-of documentary."
  },
  "learningTarget": "I can use rocks, cliffs, or terrain props to frame the castle environment and document how framing guides the viewer.",
  "bellRinger": {
    "type": "short-response",
    "prompt": "How can foreground or background objects guide attention in a scene?"
  },
  "vocabulary": [
    {
      "term": "Production log",
      "definition": "A dated record of what was built, what was captured, what changed, and what needs to happen next."
    },
    {
      "term": "Screen recording",
      "definition": "Video captured from the computer screen to show workflow, testing, or before/after changes."
    },
    {
      "term": "Behind-the-scenes footage",
      "definition": "Camera or screen-recorded evidence that shows how a project was made."
    },
    {
      "term": "B-roll",
      "definition": "Supporting footage that helps explain a process, place, detail, or action."
    },
    {
      "term": "Castle environment",
      "definition": "The Q3 Unreal scene students build, refine, walk through, and document."
    }
  ],
  "slides": {
    "title": "Q3 Lesson 10 - Rocks, Cliffs, and Scene Framing",
    "url": "",
    "status": "ready-for-chatgpt"
  },
  "assignment": {
    "id": "ue-q3-a10",
    "title": "Rocks, Cliffs, and Framing Pass",
    "submissionType": "google-drive-or-youtube-link-and-reflection",
    "evidenceRequired": [
      "Screenshot showing rocks, cliffs, or terrain framing.",
      "Daily documentary clip showing a framing decision.",
      "Production log entry for today."
    ]
  },
  "exitTicket": "What framing element did you capture today, and how does it guide the viewer?",
  "tags": [
    "placeholder",
    "unreal-engine",
    "q3",
    "castle-environment",
    "daily-documentary",
    "screen-recording",
    "process-documentation"
  ]
}
